{
  "modeloNombre": "Clasificador de PQRS Bogotá",
  "modeloVersion": "v1.0",
  "modeloEntidad": "Secretaría Distrital de Gobierno",
  "modeloArea": "Dirección de Atención al Ciudadano",
  "modeloFechaCreacion": "2025-03-10",
  "modeloFechaActualizacion": "",
  "modeloEstado": "pruebas",
  "modeloObjetivo": "Clasificar automáticamente las solicitudes ciudadanas (PQRS) en categorías temáticas para reducir tiempos de respuesta",
  "modeloCasoUso": "Soporte al proceso de gestión ciudadana",
  "modeloAlcance": "Clasificación preliminar, no toma decisiones finales",
  "modeloProcesosImpactados": "Recepción, triage, asignación de solicitudes",
  "modeloUsuariosPrevistos": "Funcionarios de PQRS, equipo TIC",
  "modeloTipo": "nlp",
  "modeloAlgoritmo": "BERT fine-tuning (transformer pre-entrenado)",
  "modeloArquitectura": "Modelo de lenguaje contextual + capa densa de clasificación",
  "modeloTecnologias": "Python, TensorFlow, HuggingFace Transformers, API REST para inferencia",
  "modeloDatasetEntrenamiento": "Dataset de Solicitudes Ciudadanas Bogotá 2018-2024 (1.2M registros). Entrenamiento: 70% de los datos",
  "modeloDatasetValidacion": "15% de los datos",
  "modeloDatasetPruebas": "15% de los datos",
  "modeloReferenciaDataSheet": "versión 1.0 - actualizado 01/03/2025",
  "modeloSesgosIdentificados": "Subrepresentación de localidades rurales → menor precisión. Solicitudes de adultos mayores presentan textos más cortos → menor F1 (0.74)",
  "modeloResultadosPruebasEquidad": "Mejor desempeño en quejas; menor en peticiones de información",
  "modeloMedidasMitigacionSesgos": "Balanceo de muestras por localidad. Data augmentation para textos cortos. Validación diferenciada por grupo",
  "modeloTecnicasExplicabilidad": "LIME y SHAP para explicabilidad local; matriz de confusión por categoría para visión global",
  "modeloInformacionPublica": "Publicación de versión ciudadana (resumen no técnico) en el portal de datos abiertos",
  "modeloMecanismosRendicionCuentas": "Comité de IA recibe reportes mensuales",
  "modeloUsosPermitidos": "apoyo al triage, análisis estadístico, mejora de eficiencia",
  "modeloUsosRestringidos": "toma de decisiones automatizadas sin revisión humana; perfilar ciudadanos; priorización automática de casos sensibles",
  "modeloUsosProhibidos": "Situaciones NO recomendadas: cuando la descripción es menor de 5 palabras (alto error)",
  "modeloBuenasPracticas": "Revisión humana obligatoria antes de enviar la solicitud al área correspondiente",
  "modeloEntradas": "texto libre de la descripción del ciudadano, metadatos opcionales (categoría inicial, canal)",
  "modeloSalidas": "categoría sugerida entre 12 clases temáticas",
  "modeloIndicadoresDesempeno": "F1 por categoría, tasa de drift, porcentaje de correcciones humanas",
  "modeloFrecuenciaReentrenamiento": "semestral",
  "modeloControlesDrift": "análisis de distribución del texto y nuevos patrones lingüísticos",
  "modeloAprobacionTecnica": "El sistema funciona según especificaciones técnicas. Rendimiento dentro de parámetros aceptables.",
  "modeloAprobacionJuridica": "Cumple con el marco normativo aplicable. Base legal adecuada para el tratamiento.",
  "modeloAprobacionDPO": "El sistema cumple con los principios de protección de datos. Se recomienda revisión semestral.",
  "modeloAprobacionComiteIA": "Aprobado - Acta 004/2025",
  "tablaMetricasGlobales": [
    {
      "Métrica": "Exactitud",
      "Valor": "0.89",
      "Descripción": "Porcentaje de clasificaciones correctas"
    },
    {
      "Métrica": "Precisión macro",
      "Valor": "0.87",
      "Descripción": "Precisión promedio por categoría"
    }
  ],
  "tablaMetricasSubpoblaciones": [
    {
      "Subpoblación": "Localidades con menor conectividad (Sumapaz, Ciudad Bolívar)",
      "Métrica": "F1",
      "Valor": "0.78",
      "Observaciones": "Menor desempeño por variaciones lingüísticas"
    }
  ],
  "tablaRiesgosModelo": [
    {
      "Tipo de Riesgo": "social",
      "Descripción": "Posible sesgo por uso de lenguaje coloquial",
      "Impacto": "medio",
      "Probabilidad": "media"
    }
  ],
  "tablaControlesModelo": [
    {
      "Tipo de Control": "reentrenamiento",
      "Descripción": "Revisión de resultados con base en comportamiento",
      "Frecuencia": "Mensual",
      "Responsable": "Dario Gomez"
    }
  ],
  "tablaHistorialModelo": [
    {
      "Versión": "v1.0",
      "Fecha": "2025-11-30",
      "Ajustes realizados": "Documento Inicial",
      "Responsable": "Dario Gomez"
    }
  ]
}